{
  "$schema": "https://json-schema.org/draft/2020-12/schema",
  "$id": "https://massive.dev/conformance/schema/workflow-spec.schema.json",
  "title": "Massive WorkflowSpec",
  "description": "WorkflowSpec transports Graph IR 0.3: static DAGs, exhaustive decisions/selects, and finite maps. Obsolete artifacts must be rebuilt with the current SDK.",
  "type": "object",
  "additionalProperties": false,
  "required": [
    "kind",
    "schemaVersion",
    "encoding",
    "hashing",
    "specHash",
    "workflow",
    "graph",
    "schemas",
    "symbols",
    "sourcePackages",
    "environments",
    "contracts"
  ],
  "properties": {
    "kind": { "const": "WorkflowSpec" },
    "schemaVersion": { "const": 0 },
    "encoding": { "const": "json-v0" },
    "hashing": { "$ref": "#/$defs/workflowSpecHashing" },
    "specHash": { "$ref": "#/$defs/hashRef" },
    "workflow": {
      "type": "object",
      "additionalProperties": false,
      "required": ["name", "inputSchema", "outputSchema"],
      "properties": {
        "name": { "$ref": "#/$defs/id" },
        "inputSchema": { "$ref": "#/$defs/hashRef" },
        "outputSchema": { "$ref": "#/$defs/hashRef" },
        "deadlineSeconds": {
          "description": "Wall-clock limit for the whole run. Absent means no run deadline.",
          "type": "integer",
          "minimum": 1,
          "maximum": 604800
        }
      }
    },
    "graph": { "$ref": "#/$defs/graph" },
    "schemas": {
      "type": "object",
      "propertyNames": { "$ref": "#/$defs/hashRef" },
      "additionalProperties": { "type": "object", "$ref": "#/$defs/portableValueSchema" }
    },
    "symbols": {
      "type": "object",
      "additionalProperties": { "$ref": "#/$defs/symbol" }
    },
    "sourcePackages": {
      "type": "object",
      "minProperties": 1,
      "additionalProperties": { "$ref": "#/$defs/sourcePackage" }
    },
    "environments": {
      "type": "object",
      "minProperties": 1,
      "propertyNames": { "$ref": "#/$defs/hashRef" },
      "additionalProperties": { "$ref": "#/$defs/environment" }
    },
    "contracts": {
      "type": "object",
      "propertyNames": { "$ref": "#/$defs/hashRef" },
      "additionalProperties": { "$ref": "#/$defs/executionContract" }
    }
  },
  "$defs": {
    "portableValueSchema": {
      "description": "Fractional multipleOf is not portable across JSON Schema validators. Rebuild the workflow with an integer divisor.",
      "anyOf": [
        {
          "type": "object",
          "properties": {
            "multipleOf": { "type": "integer", "minimum": 1 },
            "$defs": { "$ref": "#/$defs/valueSchemaMap" },
            "definitions": { "$ref": "#/$defs/valueSchemaMap" },
            "dependentSchemas": { "$ref": "#/$defs/valueSchemaMap" },
            "patternProperties": { "$ref": "#/$defs/valueSchemaMap" },
            "properties": { "$ref": "#/$defs/valueSchemaMap" },
            "additionalProperties": { "$ref": "#/$defs/portableValueSchema" },
            "contains": { "$ref": "#/$defs/portableValueSchema" },
            "contentSchema": { "$ref": "#/$defs/portableValueSchema" },
            "else": { "$ref": "#/$defs/portableValueSchema" },
            "if": { "$ref": "#/$defs/portableValueSchema" },
            "items": { "$ref": "#/$defs/portableValueSchema" },
            "not": { "$ref": "#/$defs/portableValueSchema" },
            "propertyNames": { "$ref": "#/$defs/portableValueSchema" },
            "then": { "$ref": "#/$defs/portableValueSchema" },
            "unevaluatedItems": { "$ref": "#/$defs/portableValueSchema" },
            "unevaluatedProperties": { "$ref": "#/$defs/portableValueSchema" },
            "allOf": { "$ref": "#/$defs/valueSchemaArray" },
            "anyOf": { "$ref": "#/$defs/valueSchemaArray" },
            "oneOf": { "$ref": "#/$defs/valueSchemaArray" },
            "prefixItems": { "$ref": "#/$defs/valueSchemaArray" }
          }
        },
        { "type": "boolean" }
      ]
    },
    "valueSchemaMap": {
      "type": "object",
      "additionalProperties": { "$ref": "#/$defs/portableValueSchema" }
    },
    "valueSchemaArray": {
      "type": "array",
      "items": { "$ref": "#/$defs/portableValueSchema" }
    },
    "id": {
      "type": "string",
      "minLength": 1,
      "pattern": "^[A-Za-z0-9_.@/:#-]+$"
    },
    "safePathSegment": {
      "type": "string",
      "minLength": 1,
      "maxLength": 128,
      "pattern": "^[A-Za-z0-9_.@:#-]+$",
      "not": { "enum": [".", ".."] }
    },
    "relativePath": {
      "type": "string",
      "minLength": 1,
      "not": { "pattern": "^(/|.*(^|/)\\.\\.(/|$))" }
    },
    "sourcePackagePath": {
      "type": "string",
      "minLength": 1,
      "allOf": [
        { "not": { "pattern": "^/" } },
        { "not": { "pattern": "\\\\" } },
        { "not": { "pattern": "//" } },
        { "not": { "pattern": "(^|/)\\.\\.?(/|$)" } },
        { "not": { "pattern": "/$" } }
      ]
    },
    "hashRef": {
      "type": "string",
      "pattern": "^sha256:[0-9a-f]{64}$"
    },
    "workflowSpecHashing": {
      "type": "object",
      "additionalProperties": false,
      "required": ["algorithm", "canonicalization", "recipe", "recipeVersion"],
      "properties": {
        "algorithm": { "const": "sha256" },
        "canonicalization": { "const": "canonical-json-v0" },
        "recipe": { "const": "workflow-spec" },
        "recipeVersion": { "const": 1 }
      }
    },
    "sourcePackageHashing": {
      "type": "object",
      "additionalProperties": false,
      "required": ["algorithm", "canonicalization", "recipe", "recipeVersion"],
      "properties": {
        "algorithm": { "const": "sha256" },
        "canonicalization": { "const": "canonical-json-v0" },
        "recipe": { "const": "source-package" },
        "recipeVersion": { "const": 1 }
      }
    },
    "graph": {
      "type": "object",
      "additionalProperties": false,
      "required": ["irVersion", "start", "end", "nodes", "edges"],
      "properties": {
        "irVersion": { "const": "0.3" },
        "start": { "$ref": "#/$defs/safePathSegment" },
        "end": { "$ref": "#/$defs/safePathSegment" },
        "nodes": {
          "type": "array",
          "minItems": 2,
          "items": { "$ref": "#/$defs/node" }
        },
        "edges": {
          "type": "array",
          "items": { "$ref": "#/$defs/edge" }
        },
        "exitHook": { "$ref": "#/$defs/exitHookNode" }
      }
    },
    "exitHookNode": {
      "description": "A function run once after the run settles, outside the DAG. Its input is the run-outcome schema and its output is null.",
      "type": "object",
      "additionalProperties": false,
      "required": ["id", "kind", "inputSchema", "outputSchema", "symbolRef", "contractRef"],
      "properties": {
        "id": { "$ref": "#/$defs/safePathSegment" },
        "kind": { "const": "exit-hook" },
        "inputSchema": { "$ref": "#/$defs/hashRef" },
        "outputSchema": { "$ref": "#/$defs/hashRef" },
        "symbolRef": { "$ref": "#/$defs/id" },
        "contractRef": { "$ref": "#/$defs/hashRef" }
      }
    },
    "node": {
      "oneOf": [
        { "$ref": "#/$defs/startNode" },
        { "$ref": "#/$defs/endNode" },
        { "$ref": "#/$defs/stepNode" },
        { "$ref": "#/$defs/decisionNode" },
        { "$ref": "#/$defs/selectNode" },
        { "$ref": "#/$defs/mapNode" }
      ]
    },
    "startNode": {
      "type": "object",
      "additionalProperties": false,
      "required": ["id", "kind"],
      "properties": {
        "id": { "$ref": "#/$defs/safePathSegment" },
        "kind": { "const": "start" }
      }
    },
    "endNode": {
      "type": "object",
      "additionalProperties": false,
      "required": ["id", "kind"],
      "properties": {
        "id": { "$ref": "#/$defs/safePathSegment" },
        "kind": { "const": "end" }
      }
    },
    "stepNode": {
      "type": "object",
      "additionalProperties": false,
      "required": ["id", "kind", "inputSchema", "outputSchema", "symbolRef", "contractRef"],
      "properties": {
        "id": { "$ref": "#/$defs/safePathSegment" },
        "kind": { "const": "step" },
        "inputSchema": { "$ref": "#/$defs/hashRef" },
        "outputSchema": { "$ref": "#/$defs/hashRef" },
        "symbolRef": { "$ref": "#/$defs/id" },
        "contractRef": { "$ref": "#/$defs/hashRef" },
        "mergeInputs": {
          "type": "array",
          "minItems": 1,
          "items": { "$ref": "#/$defs/safePathSegment" }
        }
      }
    },
    "mapNode": {
      "type": "object",
      "additionalProperties": false,
      "required": ["id", "kind", "inputSchema", "itemInputSchema", "itemOutputSchema", "outputSchema", "symbolRef", "contractRef", "maxConcurrency"],
      "properties": {
        "id": { "$ref": "#/$defs/safePathSegment" },
        "kind": { "const": "map" },
        "inputSchema": { "$ref": "#/$defs/hashRef" },
        "itemInputSchema": { "$ref": "#/$defs/hashRef" },
        "itemOutputSchema": { "$ref": "#/$defs/hashRef" },
        "outputSchema": { "$ref": "#/$defs/hashRef" },
        "symbolRef": { "$ref": "#/$defs/id" },
        "contractRef": { "$ref": "#/$defs/hashRef" },
        "maxConcurrency": { "type": "integer", "minimum": 1, "maximum": 4294967295 }
      }
    },
    "decisionNode": {
      "type": "object",
      "additionalProperties": false,
      "required": ["id", "kind", "inputSchema", "selector", "cases"],
      "properties": {
        "id": { "$ref": "#/$defs/safePathSegment" },
        "kind": { "const": "decision" },
        "inputSchema": { "$ref": "#/$defs/hashRef" },
        "selector": { "$ref": "#/$defs/id" },
        "cases": {
          "type": "array",
          "minItems": 1,
          "items": { "$ref": "#/$defs/decisionCase" }
        }
      }
    },
    "decisionCase": {
      "type": "object",
      "additionalProperties": false,
      "required": ["tag", "schema"],
      "properties": {
        "tag": { "type": "string", "minLength": 1 },
        "schema": { "$ref": "#/$defs/hashRef" }
      }
    },
    "selectNode": {
      "type": "object",
      "additionalProperties": false,
      "required": ["id", "kind", "decisionRef", "outputSchema", "selectInputs"],
      "properties": {
        "id": { "$ref": "#/$defs/safePathSegment" },
        "kind": { "const": "select" },
        "decisionRef": { "$ref": "#/$defs/safePathSegment" },
        "outputSchema": { "$ref": "#/$defs/hashRef" },
        "selectInputs": {
          "type": "array",
          "minItems": 1,
          "items": { "$ref": "#/$defs/selectInput" }
        }
      }
    },
    "selectInput": {
      "type": "object",
      "additionalProperties": false,
      "required": ["case", "source"],
      "properties": {
        "case": { "type": "string", "minLength": 1 },
        "source": { "$ref": "#/$defs/safePathSegment" }
      }
    },
    "unconditionalEdge": {
      "type": "object",
      "additionalProperties": false,
      "required": ["from", "to"],
      "properties": {
        "from": { "$ref": "#/$defs/safePathSegment" },
        "to": { "$ref": "#/$defs/safePathSegment" }
      }
    },
    "edge": {
      "oneOf": [
        { "$ref": "#/$defs/unconditionalEdge" },
        { "$ref": "#/$defs/conditionalEdge" }
      ]
    },
    "conditionalEdge": {
      "type": "object",
      "additionalProperties": false,
      "required": ["from", "to", "case"],
      "properties": {
        "from": { "$ref": "#/$defs/safePathSegment" },
        "to": { "$ref": "#/$defs/safePathSegment" },
        "case": { "type": "string", "minLength": 1 }
      }
    },
    "symbol": {
      "type": "object",
      "additionalProperties": false,
      "required": ["packageId", "language", "module", "export"],
      "properties": {
        "packageId": { "$ref": "#/$defs/id" },
        "language": { "enum": ["typescript", "python"] },
        "module": { "$ref": "#/$defs/relativePath" },
        "export": { "$ref": "#/$defs/id" }
      }
    },
    "sourcePackage": {
      "type": "object",
      "additionalProperties": false,
      "required": ["packageId", "language", "packageHash", "hashing", "files"],
      "properties": {
        "packageId": { "$ref": "#/$defs/id" },
        "language": { "enum": ["typescript", "python"] },
        "packageHash": { "$ref": "#/$defs/hashRef" },
        "hashing": { "$ref": "#/$defs/sourcePackageHashing" },
        "files": {
          "type": "array",
          "minItems": 1,
          "items": {
            "type": "object",
            "additionalProperties": false,
            "required": ["path", "hash"],
            "properties": {
              "path": { "$ref": "#/$defs/sourcePackagePath" },
              "hash": { "$ref": "#/$defs/hashRef" }
            }
          }
        }
      }
    },
    "environment": {
      "oneOf": [
        { "$ref": "#/$defs/containerEnvironment" },
        { "$ref": "#/$defs/nodeEnvironment" }
      ]
    },
    "containerEnvironment": {
      "type": "object",
      "additionalProperties": false,
      "required": ["kind", "image", "platform"],
      "properties": {
        "kind": { "const": "container" },
        "image": { "type": "string", "minLength": 1 },
        "command": {
          "type": "array",
          "items": { "type": "string", "minLength": 1 }
        },
        "workingDirectory": { "$ref": "#/$defs/relativePath" },
        "platform": {
          "type": "string",
          "pattern": "^[a-z0-9][a-z0-9._-]*/[a-z0-9][a-z0-9._-]*$"
        }
      }
    },
    "nodeEnvironment": {
      "type": "object",
      "additionalProperties": false,
      "required": ["kind", "version", "packageManager", "lockfile"],
      "properties": {
        "kind": { "const": "node" },
        "version": { "type": "string", "minLength": 1 },
        "packageManager": { "enum": ["npm", "pnpm", "yarn"] },
        "lockfile": { "$ref": "#/$defs/relativePath" }
      }
    },
    "executionContract": {
      "type": "object",
      "additionalProperties": false,
      "required": ["environmentRef"],
      "properties": {
        "environmentRef": { "$ref": "#/$defs/hashRef" },
        "retry": {
          "type": "object",
          "additionalProperties": false,
          "required": ["maxAttempts", "delaySeconds", "backoffFactor", "maxDelaySeconds"],
          "properties": {
            "maxAttempts": { "type": "integer", "minimum": 1, "maximum": 100 },
            "delaySeconds": { "type": "integer", "minimum": 0, "maximum": 86400 },
            "backoffFactor": { "type": "integer", "minimum": 1, "maximum": 10 },
            "maxDelaySeconds": { "type": "integer", "minimum": 0, "maximum": 86400 }
          }
        },
        "timeoutSeconds": { "type": "integer", "minimum": 1, "maximum": 604800 },
        "resources": {
          "type": "object",
          "additionalProperties": false,
          "properties": {
            "cpu": { "type": "string", "minLength": 1 },
            "memory": { "type": "string", "minLength": 1 }
          }
        },
        "secrets": {
          "type": "array",
          "items": {
            "type": "object",
            "additionalProperties": false,
            "required": ["name", "ref"],
            "properties": {
              "name": { "$ref": "#/$defs/id" },
              "ref": { "type": "string", "minLength": 1 }
            }
          }
        },
        "network": {
          "oneOf": [
            {
              "type": "object",
              "additionalProperties": false,
              "required": ["egress", "hosts"],
              "properties": {
                "egress": { "const": "declared" },
                "hosts": {
                  "type": "array",
                  "minItems": 1,
                  "items": { "type": "string", "minLength": 1 }
                }
              }
            },
            {
              "type": "object",
              "additionalProperties": false,
              "required": ["egress"],
              "properties": {
                "egress": { "enum": ["none", "any"] }
              }
            }
          ]
        }
      }
    }
  }
}
