{"contracts":{"sha256:af661e4e0357ccfce7f31ee81c33a760072f9237806f3417a64b21996fcff26b":{"environmentRef":"sha256:c66dac5ba6a70490b18e602a5dfc9edc8b776622044b8d488542c1218f4833d7"}},"encoding":"json-v0","environments":{"sha256:c66dac5ba6a70490b18e602a5dfc9edc8b776622044b8d488542c1218f4833d7":{"image":"example.invalid/python-runner@sha256:0123456789abcdef0123456789abcdef0123456789abcdef0123456789abcdef","kind":"container","platform":"linux/amd64"}},"graph":{"edges":[{"from":"__start","to":"prepare"},{"from":"combine","to":"__end"},{"from":"double","to":"pair"},{"from":"double","to":"summaries--summarize"},{"from":"pair","to":"combine"},{"from":"prepare","to":"double"},{"from":"prepare","to":"square"},{"from":"square","to":"pair"},{"from":"square","to":"summaries--summarize"},{"from":"summaries--summarize","to":"combine"}],"end":"__end","irVersion":"0.3","nodes":[{"id":"__start","kind":"start"},{"contractRef":"sha256:af661e4e0357ccfce7f31ee81c33a760072f9237806f3417a64b21996fcff26b","id":"combine","inputSchema":"sha256:3b72fda76dc62e4e4a0ad665eb8ae35cd36e1bf51dd065954c02063b4f08b245","kind":"step","mergeInputs":["pair","summaries--summarize"],"outputSchema":"sha256:6e77cc8d67c01ea6ad6e4fd8cb3743a4c2b5a6a96badc66d4996d2809d850f44","symbolRef":"python-main:workflow#combine"},{"contractRef":"sha256:af661e4e0357ccfce7f31ee81c33a760072f9237806f3417a64b21996fcff26b","id":"double","inputSchema":"sha256:e8d49aa8276a6d5835f8f5bef3d17f4f2f05f9696036b8033cf6d5d8e7a99656","kind":"step","outputSchema":"sha256:0eb9e544db958adbca595404edeff1fec5a5deca90b38d1c519f7fabba17f79d","symbolRef":"python-main:workflow#double"},{"contractRef":"sha256:af661e4e0357ccfce7f31ee81c33a760072f9237806f3417a64b21996fcff26b","id":"pair","inputSchema":"sha256:2ccc0f1d3902fc9c21c73f9d3fa3004fbc0b99626e24fd19b1827e6a872a6372","kind":"step","mergeInputs":["double","square"],"outputSchema":"sha256:6e77cc8d67c01ea6ad6e4fd8cb3743a4c2b5a6a96badc66d4996d2809d850f44","symbolRef":"python-main:workflow#pair"},{"contractRef":"sha256:af661e4e0357ccfce7f31ee81c33a760072f9237806f3417a64b21996fcff26b","id":"prepare","inputSchema":"sha256:e8d49aa8276a6d5835f8f5bef3d17f4f2f05f9696036b8033cf6d5d8e7a99656","kind":"step","outputSchema":"sha256:e8d49aa8276a6d5835f8f5bef3d17f4f2f05f9696036b8033cf6d5d8e7a99656","symbolRef":"python-main:workflow#prepare"},{"contractRef":"sha256:af661e4e0357ccfce7f31ee81c33a760072f9237806f3417a64b21996fcff26b","id":"square","inputSchema":"sha256:e8d49aa8276a6d5835f8f5bef3d17f4f2f05f9696036b8033cf6d5d8e7a99656","kind":"step","outputSchema":"sha256:fbe99b266d51c48beb4b43c16f1b811dc3554013fbffb4089930136eda6fe278","symbolRef":"python-main:workflow#square"},{"contractRef":"sha256:af661e4e0357ccfce7f31ee81c33a760072f9237806f3417a64b21996fcff26b","id":"summaries--summarize","inputSchema":"sha256:2075ffeda329c06a6713e98bed6e2c4d4513c75ef6f1d074f151088946a56073","kind":"step","mergeInputs":["double","square"],"outputSchema":"sha256:6e77cc8d67c01ea6ad6e4fd8cb3743a4c2b5a6a96badc66d4996d2809d850f44","symbolRef":"python-main:workflow#summarize"},{"id":"__end","kind":"end"}],"start":"__start"},"hashing":{"algorithm":"sha256","canonicalization":"canonical-json-v0","recipe":"workflow-spec","recipeVersion":1},"kind":"WorkflowSpec","schemaVersion":0,"schemas":{"sha256:0eb9e544db958adbca595404edeff1fec5a5deca90b38d1c519f7fabba17f79d":{"properties":{"kind":{"const":"doubled","title":"Kind","type":"string"},"value":{"title":"Value","type":"integer"}},"required":["kind","value"],"title":"Doubled","type":"object"},"sha256:2075ffeda329c06a6713e98bed6e2c4d4513c75ef6f1d074f151088946a56073":{"$defs":{"Doubled":{"properties":{"kind":{"const":"doubled","title":"Kind","type":"string"},"value":{"title":"Value","type":"integer"}},"required":["kind","value"],"title":"Doubled","type":"object"},"Squared":{"properties":{"kind":{"const":"squared","title":"Kind","type":"string"},"value":{"title":"Value","type":"integer"}},"required":["kind","value"],"title":"Squared","type":"object"}},"items":{"discriminator":{"mapping":{"doubled":"#/$defs/Doubled","squared":"#/$defs/Squared"},"propertyName":"kind"},"oneOf":[{"$ref":"#/$defs/Doubled"},{"$ref":"#/$defs/Squared"}]},"type":"array"},"sha256:2ccc0f1d3902fc9c21c73f9d3fa3004fbc0b99626e24fd19b1827e6a872a6372":{"$defs":{"Doubled":{"properties":{"kind":{"const":"doubled","title":"Kind","type":"string"},"value":{"title":"Value","type":"integer"}},"required":["kind","value"],"title":"Doubled","type":"object"},"Squared":{"properties":{"kind":{"const":"squared","title":"Kind","type":"string"},"value":{"title":"Value","type":"integer"}},"required":["kind","value"],"title":"Squared","type":"object"}},"maxItems":2,"minItems":2,"prefixItems":[{"$ref":"#/$defs/Doubled"},{"$ref":"#/$defs/Squared"}],"type":"array"},"sha256:3b72fda76dc62e4e4a0ad665eb8ae35cd36e1bf51dd065954c02063b4f08b245":{"$defs":{"Report":{"description":"Records each received value's decoded model, so order and decoding are visible.","properties":{"parts":{"items":{"type":"string"},"title":"Parts","type":"array"}},"required":["parts"],"title":"Report","type":"object"}},"maxItems":2,"minItems":2,"prefixItems":[{"$ref":"#/$defs/Report"},{"$ref":"#/$defs/Report"}],"type":"array"},"sha256:6e77cc8d67c01ea6ad6e4fd8cb3743a4c2b5a6a96badc66d4996d2809d850f44":{"description":"Records each received value's decoded model, so order and decoding are visible.","properties":{"parts":{"items":{"type":"string"},"title":"Parts","type":"array"}},"required":["parts"],"title":"Report","type":"object"},"sha256:e8d49aa8276a6d5835f8f5bef3d17f4f2f05f9696036b8033cf6d5d8e7a99656":{"properties":{"value":{"title":"Value","type":"integer"}},"required":["value"],"title":"Request","type":"object"},"sha256:fbe99b266d51c48beb4b43c16f1b811dc3554013fbffb4089930136eda6fe278":{"properties":{"kind":{"const":"squared","title":"Kind","type":"string"},"value":{"title":"Value","type":"integer"}},"required":["kind","value"],"title":"Squared","type":"object"}},"sourcePackages":{"python-main":{"files":[{"hash":"sha256:fb39349297d028e05725d5b9d16646a64424b49dc76d21ff9b6ee53aeffc5808","path":"workflow.py"}],"hashing":{"algorithm":"sha256","canonicalization":"canonical-json-v0","recipe":"source-package","recipeVersion":1},"language":"python","packageHash":"sha256:54803db78a1f079144fae6a8a85a54bee45f2de3cd5748ea51d56080d96206b4","packageId":"python-main"}},"specHash":"sha256:74af55be81090cd423ed7f53d0c452bd0267c3857f77a49421cc3408dab44bd0","symbols":{"python-main:workflow#combine":{"export":"combine","language":"python","module":"workflow","packageId":"python-main"},"python-main:workflow#double":{"export":"double","language":"python","module":"workflow","packageId":"python-main"},"python-main:workflow#pair":{"export":"pair","language":"python","module":"workflow","packageId":"python-main"},"python-main:workflow#prepare":{"export":"prepare","language":"python","module":"workflow","packageId":"python-main"},"python-main:workflow#square":{"export":"square","language":"python","module":"workflow","packageId":"python-main"},"python-main:workflow#summarize":{"export":"summarize","language":"python","module":"workflow","packageId":"python-main"}},"workflow":{"inputSchema":"sha256:e8d49aa8276a6d5835f8f5bef3d17f4f2f05f9696036b8033cf6d5d8e7a99656","name":"python-fan-in","outputSchema":"sha256:6e77cc8d67c01ea6ad6e4fd8cb3743a4c2b5a6a96badc66d4996d2809d850f44"}}
