{
  "kind": "WorkflowSpec",
  "schemaVersion": 0,
  "encoding": "json-v0",
  "hashing": {
    "algorithm": "sha256",
    "canonicalization": "canonical-json-v0",
    "recipe": "workflow-spec",
    "recipeVersion": 1
  },
  "specHash": "sha256:9f8a7d85870c4e0a0945516cf25eb3e597f3d44b7875917c3dcd142f85200f6d",
  "workflow": {
    "name": "linear-chain",
    "inputSchema": "sha256:1111111111111111111111111111111111111111111111111111111111111111",
    "outputSchema": "sha256:2222222222222222222222222222222222222222222222222222222222222222"
  },
  "graph": {
    "irVersion": "0.3",
    "start": "__start",
    "end": "__end",
    "nodes": [
      { "id": "__start", "kind": "start" },
      { "id": "__end", "kind": "end" },
      {
        "id": "double",
        "kind": "step",
        "inputSchema": "sha256:1111111111111111111111111111111111111111111111111111111111111111",
        "outputSchema": "sha256:1111111111111111111111111111111111111111111111111111111111111111",
        "symbolRef": "linear-chain/double",
        "contractRef": "sha256:8888888888888888888888888888888888888888888888888888888888888888"
      },
      {
        "id": "increment",
        "kind": "step",
        "inputSchema": "sha256:1111111111111111111111111111111111111111111111111111111111111111",
        "outputSchema": "sha256:1111111111111111111111111111111111111111111111111111111111111111",
        "symbolRef": "linear-chain/increment",
        "contractRef": "sha256:8888888888888888888888888888888888888888888888888888888888888888"
      },
      {
        "id": "label",
        "kind": "step",
        "inputSchema": "sha256:1111111111111111111111111111111111111111111111111111111111111111",
        "outputSchema": "sha256:2222222222222222222222222222222222222222222222222222222222222222",
        "symbolRef": "linear-chain/label",
        "contractRef": "sha256:8888888888888888888888888888888888888888888888888888888888888888"
      }
    ],
    "edges": [
      { "from": "__start", "to": "double" },
      { "from": "double", "to": "increment" },
      { "from": "increment", "to": "label" },
      { "from": "label", "to": "__end" }
    ]
  },
  "schemas": {
    "sha256:1111111111111111111111111111111111111111111111111111111111111111": {
      "type": "number"
    },
    "sha256:2222222222222222222222222222222222222222222222222222222222222222": {
      "type": "string"
    }
  },
  "symbols": {
    "linear-chain/double": {
      "packageId": "ts-main",
      "language": "typescript",
      "module": "./workflow.ts",
      "export": "double"
    },
    "linear-chain/increment": {
      "packageId": "ts-main",
      "language": "typescript",
      "module": "./workflow.ts",
      "export": "increment"
    },
    "linear-chain/label": {
      "packageId": "ts-main",
      "language": "typescript",
      "module": "./workflow.ts",
      "export": "label"
    }
  },
  "sourcePackages": {
    "ts-main": {
      "packageId": "ts-main",
      "language": "typescript",
      "packageHash": "sha256:0ec03733f4bf566d30620befc143f4f33748c1ec0d780dfd91ab47dc5c5c764f",
      "hashing": {
        "algorithm": "sha256",
        "canonicalization": "canonical-json-v0",
        "recipe": "source-package",
        "recipeVersion": 1
      },
      "files": [
        {
          "path": "workflow.ts",
          "hash": "sha256:eeeeeeeeeeeeeeeeeeeeeeeeeeeeeeeeeeeeeeeeeeeeeeeeeeeeeeeeeeeeeeee"
        }
      ]
    }
  },
  "environments": {
    "sha256:7777777777777777777777777777777777777777777777777777777777777777": {
      "kind": "container",
      "image": "ghcr.io/massive-dev/typescript-runner@sha256:0123456789abcdef0123456789abcdef0123456789abcdef0123456789abcdef",
      "platform": "linux/amd64"
    }
  },
  "contracts": {
    "sha256:8888888888888888888888888888888888888888888888888888888888888888": {
      "environmentRef": "sha256:7777777777777777777777777777777777777777777777777777777777777777",
      "resources": {
        "cpu": "500m",
        "memory": "512Mi"
      },
      "network": {
        "egress": "any"
      }
    }
  }
}
