{
  "kind": "WorkflowSpec",
  "schemaVersion": 0,
  "encoding": "json-v0",
  "hashing": {
    "algorithm": "sha256",
    "canonicalization": "canonical-json-v0",
    "recipe": "workflow-spec",
    "recipeVersion": 1
  },
  "specHash": "sha256:0ae843df03ea7a7a8275b0e23f628912937649a9873234b0a164183f5aa958aa",
  "workflow": {
    "name": "multi-stage-merge",
    "inputSchema": "sha256:1111111111111111111111111111111111111111111111111111111111111111",
    "outputSchema": "sha256:1111111111111111111111111111111111111111111111111111111111111111"
  },
  "graph": {
    "irVersion": "0.3",
    "start": "__start",
    "end": "__end",
    "nodes": [
      { "id": "__start", "kind": "start" },
      { "id": "__end", "kind": "end" },
      {
        "id": "split",
        "kind": "step",
        "inputSchema": "sha256:1111111111111111111111111111111111111111111111111111111111111111",
        "outputSchema": "sha256:1111111111111111111111111111111111111111111111111111111111111111",
        "symbolRef": "multi-stage-merge/split",
        "contractRef": "sha256:8888888888888888888888888888888888888888888888888888888888888888"
      },
      {
        "id": "a1",
        "kind": "step",
        "inputSchema": "sha256:1111111111111111111111111111111111111111111111111111111111111111",
        "outputSchema": "sha256:1111111111111111111111111111111111111111111111111111111111111111",
        "symbolRef": "multi-stage-merge/a1",
        "contractRef": "sha256:8888888888888888888888888888888888888888888888888888888888888888"
      },
      {
        "id": "a2",
        "kind": "step",
        "inputSchema": "sha256:1111111111111111111111111111111111111111111111111111111111111111",
        "outputSchema": "sha256:1111111111111111111111111111111111111111111111111111111111111111",
        "symbolRef": "multi-stage-merge/a2",
        "contractRef": "sha256:8888888888888888888888888888888888888888888888888888888888888888"
      },
      {
        "id": "b1",
        "kind": "step",
        "inputSchema": "sha256:1111111111111111111111111111111111111111111111111111111111111111",
        "outputSchema": "sha256:1111111111111111111111111111111111111111111111111111111111111111",
        "symbolRef": "multi-stage-merge/b1",
        "contractRef": "sha256:8888888888888888888888888888888888888888888888888888888888888888"
      },
      {
        "id": "b2",
        "kind": "step",
        "inputSchema": "sha256:1111111111111111111111111111111111111111111111111111111111111111",
        "outputSchema": "sha256:1111111111111111111111111111111111111111111111111111111111111111",
        "symbolRef": "multi-stage-merge/b2",
        "contractRef": "sha256:8888888888888888888888888888888888888888888888888888888888888888"
      },
      {
        "id": "merge-a",
        "kind": "step",
        "inputSchema": "sha256:3333333333333333333333333333333333333333333333333333333333333333",
        "outputSchema": "sha256:1111111111111111111111111111111111111111111111111111111111111111",
        "symbolRef": "multi-stage-merge/merge-a",
        "contractRef": "sha256:8888888888888888888888888888888888888888888888888888888888888888",
        "mergeInputs": ["a1", "a2"]
      },
      {
        "id": "merge-b",
        "kind": "step",
        "inputSchema": "sha256:3333333333333333333333333333333333333333333333333333333333333333",
        "outputSchema": "sha256:1111111111111111111111111111111111111111111111111111111111111111",
        "symbolRef": "multi-stage-merge/merge-b",
        "contractRef": "sha256:8888888888888888888888888888888888888888888888888888888888888888",
        "mergeInputs": ["b1", "b2"]
      },
      {
        "id": "merge-final",
        "kind": "step",
        "inputSchema": "sha256:3333333333333333333333333333333333333333333333333333333333333333",
        "outputSchema": "sha256:1111111111111111111111111111111111111111111111111111111111111111",
        "symbolRef": "multi-stage-merge/merge-final",
        "contractRef": "sha256:8888888888888888888888888888888888888888888888888888888888888888",
        "mergeInputs": ["merge-a", "merge-b"]
      }
    ],
    "edges": [
      { "from": "__start", "to": "split" },
      { "from": "split", "to": "a1" },
      { "from": "split", "to": "a2" },
      { "from": "split", "to": "b1" },
      { "from": "split", "to": "b2" },
      { "from": "a1", "to": "merge-a" },
      { "from": "a2", "to": "merge-a" },
      { "from": "b1", "to": "merge-b" },
      { "from": "b2", "to": "merge-b" },
      { "from": "merge-a", "to": "merge-final" },
      { "from": "merge-b", "to": "merge-final" },
      { "from": "merge-final", "to": "__end" }
    ]
  },
  "schemas": {
    "sha256:1111111111111111111111111111111111111111111111111111111111111111": {
      "type": "number"
    },
    "sha256:3333333333333333333333333333333333333333333333333333333333333333": {
      "type": "array",
      "items": {
        "type": "number"
      }
    }
  },
  "symbols": {
    "multi-stage-merge/split": {
      "packageId": "ts-main",
      "language": "typescript",
      "module": "./workflow.ts",
      "export": "split"
    },
    "multi-stage-merge/a1": {
      "packageId": "ts-main",
      "language": "typescript",
      "module": "./workflow.ts",
      "export": "a1"
    },
    "multi-stage-merge/a2": {
      "packageId": "ts-main",
      "language": "typescript",
      "module": "./workflow.ts",
      "export": "a2"
    },
    "multi-stage-merge/b1": {
      "packageId": "ts-main",
      "language": "typescript",
      "module": "./workflow.ts",
      "export": "b1"
    },
    "multi-stage-merge/b2": {
      "packageId": "ts-main",
      "language": "typescript",
      "module": "./workflow.ts",
      "export": "b2"
    },
    "multi-stage-merge/merge-a": {
      "packageId": "ts-main",
      "language": "typescript",
      "module": "./workflow.ts",
      "export": "mergeA"
    },
    "multi-stage-merge/merge-b": {
      "packageId": "ts-main",
      "language": "typescript",
      "module": "./workflow.ts",
      "export": "mergeB"
    },
    "multi-stage-merge/merge-final": {
      "packageId": "ts-main",
      "language": "typescript",
      "module": "./workflow.ts",
      "export": "mergeFinal"
    }
  },
  "sourcePackages": {
    "ts-main": {
      "packageId": "ts-main",
      "language": "typescript",
      "packageHash": "sha256:0ec03733f4bf566d30620befc143f4f33748c1ec0d780dfd91ab47dc5c5c764f",
      "hashing": {
        "algorithm": "sha256",
        "canonicalization": "canonical-json-v0",
        "recipe": "source-package",
        "recipeVersion": 1
      },
      "files": [
        {
          "path": "workflow.ts",
          "hash": "sha256:eeeeeeeeeeeeeeeeeeeeeeeeeeeeeeeeeeeeeeeeeeeeeeeeeeeeeeeeeeeeeeee"
        }
      ]
    }
  },
  "environments": {
    "sha256:7777777777777777777777777777777777777777777777777777777777777777": {
      "kind": "container",
      "image": "ghcr.io/massive-dev/typescript-runner@sha256:0123456789abcdef0123456789abcdef0123456789abcdef0123456789abcdef",
      "platform": "linux/amd64"
    }
  },
  "contracts": {
    "sha256:8888888888888888888888888888888888888888888888888888888888888888": {
      "environmentRef": "sha256:7777777777777777777777777777777777777777777777777777777777777777",
      "resources": {
        "cpu": "500m",
        "memory": "512Mi"
      },
      "network": {
        "egress": "none"
      }
    }
  }
}
