{"contracts":{"sha256:af661e4e0357ccfce7f31ee81c33a760072f9237806f3417a64b21996fcff26b":{"environmentRef":"sha256:c66dac5ba6a70490b18e602a5dfc9edc8b776622044b8d488542c1218f4833d7"}},"encoding":"json-v0","environments":{"sha256:c66dac5ba6a70490b18e602a5dfc9edc8b776622044b8d488542c1218f4833d7":{"image":"example.invalid/python-runner@sha256:0123456789abcdef0123456789abcdef0123456789abcdef0123456789abcdef","kind":"container","platform":"linux/amd64"}},"graph":{"edges":[{"from":"__start","to":"add_one"},{"from":"add_one","to":"__end"}],"end":"__end","irVersion":"0.3","nodes":[{"id":"__start","kind":"start"},{"contractRef":"sha256:af661e4e0357ccfce7f31ee81c33a760072f9237806f3417a64b21996fcff26b","id":"add_one","inputSchema":"sha256:e8d49aa8276a6d5835f8f5bef3d17f4f2f05f9696036b8033cf6d5d8e7a99656","kind":"step","outputSchema":"sha256:fc562f2c03656e754c7d774b78e6e8669afd01d454d632293d05459ebce4b63f","symbolRef":"python-main:workflow#add_one"},{"id":"__end","kind":"end"}],"start":"__start"},"hashing":{"algorithm":"sha256","canonicalization":"canonical-json-v0","recipe":"workflow-spec","recipeVersion":1},"kind":"WorkflowSpec","schemaVersion":0,"schemas":{"sha256:e8d49aa8276a6d5835f8f5bef3d17f4f2f05f9696036b8033cf6d5d8e7a99656":{"properties":{"value":{"title":"Value","type":"integer"}},"required":["value"],"title":"Request","type":"object"},"sha256:fc562f2c03656e754c7d774b78e6e8669afd01d454d632293d05459ebce4b63f":{"properties":{"value":{"title":"Value","type":"integer"}},"required":["value"],"title":"Result","type":"object"}},"sourcePackages":{"python-main":{"files":[{"hash":"sha256:95ab3cab6352d8de63b403d393688ae53759bb0b8253617f6c6c5ce31397acfe","path":"helper.py"},{"hash":"sha256:74dc4e5f020594f8a1eadf1b60f1ba8d583f6002a19ccc157f870264de3d9b7e","path":"workflow.py"}],"hashing":{"algorithm":"sha256","canonicalization":"canonical-json-v0","recipe":"source-package","recipeVersion":1},"language":"python","packageHash":"sha256:e751dc60a4693b6cb0d990f15861b5aede3a2f3ca8aee0a91fa72f58e6dff965","packageId":"python-main"}},"specHash":"sha256:a9977baabb1f5d08cc111e25d9ecd00dd1879c12171f8a6c487a84edd87ca315","symbols":{"python-main:workflow#add_one":{"export":"add_one","language":"python","module":"workflow","packageId":"python-main"}},"workflow":{"inputSchema":"sha256:e8d49aa8276a6d5835f8f5bef3d17f4f2f05f9696036b8033cf6d5d8e7a99656","name":"python-linear","outputSchema":"sha256:fc562f2c03656e754c7d774b78e6e8669afd01d454d632293d05459ebce4b63f"}}
