{
  "kind": "WorkflowSpec",
  "schemaVersion": 0,
  "encoding": "json-v0",
  "hashing": {
    "algorithm": "sha256",
    "canonicalization": "canonical-json-v0",
    "recipe": "workflow-spec",
    "recipeVersion": 1
  },
  "specHash": "sha256:8dcc980025762583536e57faaa1cc32f55490a3b71c05a8a2c2465b1594c5e59",
  "workflow": {
    "name": "uneven-fan-in",
    "inputSchema": "sha256:1111111111111111111111111111111111111111111111111111111111111111",
    "outputSchema": "sha256:1111111111111111111111111111111111111111111111111111111111111111"
  },
  "graph": {
    "irVersion": "0.3",
    "start": "__start",
    "end": "__end",
    "nodes": [
      { "id": "__start", "kind": "start" },
      { "id": "__end", "kind": "end" },
      {
        "id": "split",
        "kind": "step",
        "inputSchema": "sha256:1111111111111111111111111111111111111111111111111111111111111111",
        "outputSchema": "sha256:1111111111111111111111111111111111111111111111111111111111111111",
        "symbolRef": "uneven-fan-in/split",
        "contractRef": "sha256:8888888888888888888888888888888888888888888888888888888888888888"
      },
      {
        "id": "short",
        "kind": "step",
        "inputSchema": "sha256:1111111111111111111111111111111111111111111111111111111111111111",
        "outputSchema": "sha256:1111111111111111111111111111111111111111111111111111111111111111",
        "symbolRef": "uneven-fan-in/short",
        "contractRef": "sha256:8888888888888888888888888888888888888888888888888888888888888888"
      },
      {
        "id": "long",
        "kind": "step",
        "inputSchema": "sha256:1111111111111111111111111111111111111111111111111111111111111111",
        "outputSchema": "sha256:1111111111111111111111111111111111111111111111111111111111111111",
        "symbolRef": "uneven-fan-in/long",
        "contractRef": "sha256:8888888888888888888888888888888888888888888888888888888888888888"
      },
      {
        "id": "long-tail",
        "kind": "step",
        "inputSchema": "sha256:1111111111111111111111111111111111111111111111111111111111111111",
        "outputSchema": "sha256:1111111111111111111111111111111111111111111111111111111111111111",
        "symbolRef": "uneven-fan-in/long-tail",
        "contractRef": "sha256:8888888888888888888888888888888888888888888888888888888888888888"
      },
      {
        "id": "merge",
        "kind": "step",
        "inputSchema": "sha256:3333333333333333333333333333333333333333333333333333333333333333",
        "outputSchema": "sha256:1111111111111111111111111111111111111111111111111111111111111111",
        "symbolRef": "uneven-fan-in/merge",
        "contractRef": "sha256:8888888888888888888888888888888888888888888888888888888888888888",
        "mergeInputs": ["short", "long-tail"]
      }
    ],
    "edges": [
      { "from": "__start", "to": "split" },
      { "from": "split", "to": "short" },
      { "from": "split", "to": "long" },
      { "from": "long", "to": "long-tail" },
      { "from": "short", "to": "merge" },
      { "from": "long-tail", "to": "merge" },
      { "from": "merge", "to": "__end" }
    ]
  },
  "schemas": {
    "sha256:1111111111111111111111111111111111111111111111111111111111111111": {
      "type": "number"
    },
    "sha256:3333333333333333333333333333333333333333333333333333333333333333": {
      "type": "array",
      "items": {
        "type": "number"
      }
    }
  },
  "symbols": {
    "uneven-fan-in/split": {
      "packageId": "ts-main",
      "language": "typescript",
      "module": "./workflow.ts",
      "export": "split"
    },
    "uneven-fan-in/short": {
      "packageId": "ts-main",
      "language": "typescript",
      "module": "./workflow.ts",
      "export": "short"
    },
    "uneven-fan-in/long": {
      "packageId": "ts-main",
      "language": "typescript",
      "module": "./workflow.ts",
      "export": "long"
    },
    "uneven-fan-in/long-tail": {
      "packageId": "ts-main",
      "language": "typescript",
      "module": "./workflow.ts",
      "export": "longTail"
    },
    "uneven-fan-in/merge": {
      "packageId": "ts-main",
      "language": "typescript",
      "module": "./workflow.ts",
      "export": "merge"
    }
  },
  "sourcePackages": {
    "ts-main": {
      "packageId": "ts-main",
      "language": "typescript",
      "packageHash": "sha256:0ec03733f4bf566d30620befc143f4f33748c1ec0d780dfd91ab47dc5c5c764f",
      "hashing": {
        "algorithm": "sha256",
        "canonicalization": "canonical-json-v0",
        "recipe": "source-package",
        "recipeVersion": 1
      },
      "files": [
        {
          "path": "workflow.ts",
          "hash": "sha256:eeeeeeeeeeeeeeeeeeeeeeeeeeeeeeeeeeeeeeeeeeeeeeeeeeeeeeeeeeeeeeee"
        }
      ]
    }
  },
  "environments": {
    "sha256:7777777777777777777777777777777777777777777777777777777777777777": {
      "kind": "container",
      "image": "ghcr.io/massive-dev/typescript-runner@sha256:0123456789abcdef0123456789abcdef0123456789abcdef0123456789abcdef",
      "platform": "linux/amd64"
    }
  },
  "contracts": {
    "sha256:8888888888888888888888888888888888888888888888888888888888888888": {
      "environmentRef": "sha256:7777777777777777777777777777777777777777777777777777777777777777",
      "resources": {
        "cpu": "500m",
        "memory": "512Mi"
      },
      "network": {
        "egress": "none"
      }
    }
  }
}
