{
  "kind": "WorkflowSpec",
  "schemaVersion": 0,
  "encoding": "json-v0",
  "hashing": {
    "algorithm": "sha256",
    "canonicalization": "canonical-json-v0",
    "recipe": "workflow-spec",
    "recipeVersion": 1
  },
  "specHash": "sha256:612decb8e0b55c6ef66a13b983374ad862516971c529da0dc854a98dc08f5bbb",
  "workflow": {
    "name": "passthrough",
    "inputSchema": "sha256:1111111111111111111111111111111111111111111111111111111111111111",
    "outputSchema": "sha256:1111111111111111111111111111111111111111111111111111111111111111"
  },
  "graph": {
    "irVersion": "0.3",
    "start": "__start",
    "end": "__end",
    "nodes": [
      { "id": "__start", "kind": "start" },
      { "id": "__end", "kind": "end" }
    ],
    "edges": [
      { "from": "__start", "to": "__end" }
    ]
  },
  "schemas": {
    "sha256:1111111111111111111111111111111111111111111111111111111111111111": {
      "type": "number"
    }
  },
  "symbols": {},
  "sourcePackages": {
    "ts-main": {
      "packageId": "ts-main",
      "language": "typescript",
      "packageHash": "sha256:0ec03733f4bf566d30620befc143f4f33748c1ec0d780dfd91ab47dc5c5c764f",
      "hashing": {
        "algorithm": "sha256",
        "canonicalization": "canonical-json-v0",
        "recipe": "source-package",
        "recipeVersion": 1
      },
      "files": [
        {
          "path": "workflow.ts",
          "hash": "sha256:eeeeeeeeeeeeeeeeeeeeeeeeeeeeeeeeeeeeeeeeeeeeeeeeeeeeeeeeeeeeeeee"
        }
      ]
    }
  },
  "environments": {
    "sha256:7777777777777777777777777777777777777777777777777777777777777777": {
      "kind": "container",
      "image": "ghcr.io/massive-dev/typescript-runner@sha256:0123456789abcdef0123456789abcdef0123456789abcdef0123456789abcdef",
      "platform": "linux/amd64"
    }
  },
  "contracts": {
    "sha256:8888888888888888888888888888888888888888888888888888888888888888": {
      "environmentRef": "sha256:7777777777777777777777777777777777777777777777777777777777777777",
      "network": {
        "egress": "any"
      }
    }
  }
}
